{
  "$schema": "https://json-schema.org/draft/2020-12/schema",
  "title": "OneCompany Work Unit Assurance Packet",
  "type": "object",
  "required": ["work_unit", "status", "objective", "risk_level", "quality_profile", "code_change", "requirements", "acceptance_criteria", "risks", "traceability", "test_plan", "documentation_impact", "architecture_impact", "release", "evidence"],
  "properties": {
    "work_unit": {"type": "string", "pattern": "^WU(?:[0-9]+|-[A-Z0-9-]+)$"},
    "status": {"enum": ["draft", "ready", "in_progress", "merge_ready", "done"]},
    "objective": {"type": "string", "minLength": 10},
    "risk_level": {"enum": ["low", "medium", "high", "critical"]},
    "quality_profile": {"enum": ["prototype", "standard", "production", "high_assurance", "regulated"]},
    "code_change": {"type": "boolean"},
    "candidate_sha": {"type": "string", "pattern": "^[0-9a-f]{40}$"},
    "material_authors": {"type": "array", "items": {"type": "string", "minLength": 1}, "uniqueItems": true},
    "requirements": {"type": "array", "items": {"$ref": "requirement.schema.json"}},
    "acceptance_criteria": {
      "type": "array",
      "items": {
        "type": "object",
        "required": ["id", "statement", "verification_method"],
        "properties": {
          "id": {"type": "string", "pattern": "^AC-[0-9]{3,}$"},
          "statement": {"type": "string", "minLength": 10},
          "verification_method": {"type": "string", "minLength": 1}
        },
        "additionalProperties": true
      }
    },
    "risks": {"type": "array", "items": {"$ref": "risk.schema.json"}},
    "traceability": {
      "type": "array",
      "items": {
        "type": "object",
        "required": ["source", "target", "relationship"],
        "properties": {
          "source": {"type": "string", "minLength": 1},
          "target": {"type": "string", "minLength": 1},
          "relationship": {"enum": ["objective_to_requirement", "requirement_to_acceptance_criterion", "requirement_to_risk", "requirement_to_design_or_architecture", "requirement_to_work_unit", "requirement_to_test", "test_to_evidence", "risk_to_mitigation", "mitigation_to_test", "change_to_requirement"]}
        },
        "additionalProperties": false
      }
    },
    "test_plan": {
      "type": "object",
      "required": ["families", "tests"],
      "properties": {
        "families": {"type": "array", "items": {"type": "string"}, "uniqueItems": true},
        "tests": {
          "type": "array",
          "items": {
            "type": "object",
            "required": ["id", "family", "covers"],
            "properties": {
              "id": {"type": "string", "pattern": "^TEST-[0-9]{3,}$"},
              "family": {"type": "string", "minLength": 1},
              "covers": {"type": "array", "minItems": 1, "items": {"type": "string"}, "uniqueItems": true}
            },
            "additionalProperties": true
          }
        }
      },
      "additionalProperties": true
    },
    "documentation_impact": {"type": "object"},
    "architecture_impact": {"type": "object"},
    "release": {"type": "object"},
    "evidence": {
      "type": "object",
      "properties": {
        "sha": {"type": "string", "pattern": "^[0-9a-f]{40}$"},
        "verified_requirements": {"type": "array", "items": {"type": "string"}, "uniqueItems": true},
        "verified_acceptance_criteria": {"type": "array", "items": {"type": "string"}, "uniqueItems": true},
        "artifacts": {
          "type": "array",
          "items": {
            "type": "object",
            "required": ["id", "kind", "reference"],
            "properties": {
              "id": {"type": "string", "pattern": "^EVID-[0-9]{3,}$"},
              "kind": {"type": "string", "minLength": 1},
              "reference": {"type": "string", "minLength": 1}
            },
            "additionalProperties": true
          }
        },
        "coverage": {"type": "object"},
        "test_family_results": {"type": "object"},
        "gates": {"type": "object"},
        "independent_review": {
          "type": "object",
          "required": ["actor", "sha", "verdict"],
          "properties": {
            "actor": {"type": "string", "minLength": 1},
            "sha": {"type": "string", "pattern": "^[0-9a-f]{40}$"},
            "verdict": {"const": "pass"}
          },
          "additionalProperties": true
        }
      },
      "additionalProperties": true
    }
  },
  "allOf": [
    {
      "if": {"properties": {"status": {"enum": ["ready", "in_progress", "merge_ready", "done"]}}, "required": ["status"]},
      "then": {
        "properties": {
          "requirements": {"minItems": 1},
          "acceptance_criteria": {"minItems": 1},
          "traceability": {"minItems": 1},
          "test_plan": {
            "properties": {
              "families": {"minItems": 1},
              "tests": {"minItems": 1}
            }
          }
        }
      }
    },
    {
      "if": {"properties": {"status": {"enum": ["merge_ready", "done"]}}, "required": ["status"]},
      "then": {
        "required": ["candidate_sha"],
        "properties": {
          "evidence": {"required": ["sha", "verified_requirements", "verified_acceptance_criteria", "artifacts", "coverage", "test_family_results", "gates", "independent_review"]}
        }
      }
    }
  ],
  "additionalProperties": true
}
