{
  "work_unit": "WU900",
  "status": "merge_ready",
  "objective": "Demonstrate a fully traceable high-risk assurance packet through exact-head merge evidence.",
  "risk_level": "high",
  "quality_profile": "production",
  "code_change": true,
  "candidate_sha": "aaaaaaaaaaaaaaaaaaaaaaaaaaaaaaaaaaaaaaaa",
  "material_authors": ["implementer-example"],
  "requirements": [
    {
      "id": "FR-900", "type": "functional", "statement": "The system shall reject an unauthenticated deletion request.",
      "rationale": "Prevent unauthorized destructive actions.", "source": "product-security", "priority": "must", "status": "verified",
      "verification_method": "test", "acceptance_criteria": ["AC-900"], "risk_ids": ["RISK-900"]
    }
  ],
  "acceptance_criteria": [
    {"id": "AC-900", "statement": "Given no authenticated principal, when deletion is requested, then the service returns a denial and no record is deleted.", "verification_method": "automated-test"}
  ],
  "risks": [
    {
      "id": "RISK-900", "title": "Unauthorized destructive action", "domain": "security",
      "cause": "A deletion endpoint may be invoked without a valid principal", "event": "an unauthorized deletion is accepted",
      "consequence": "protected data is lost", "likelihood": 3, "impact": 5, "inherent_score": 15, "owner": "security-reviewer",
      "treatment": "reduce", "mitigations": [{"id": "MIT-900", "description": "Enforce authentication and authorization before deletion"}],
      "residual_likelihood": 1, "residual_impact": 5, "residual_score": 5, "status": "treated", "review_trigger": "auth or deletion-path change"
    }
  ],
  "traceability": [
    {"source": "OBJ-900", "target": "FR-900", "relationship": "objective_to_requirement"},
    {"source": "FR-900", "target": "AC-900", "relationship": "requirement_to_acceptance_criterion"},
    {"source": "FR-900", "target": "RISK-900", "relationship": "requirement_to_risk"},
    {"source": "FR-900", "target": "DESIGN-900", "relationship": "requirement_to_design_or_architecture"},
    {"source": "FR-900", "target": "WU900", "relationship": "requirement_to_work_unit"},
    {"source": "FR-900", "target": "TEST-900", "relationship": "requirement_to_test"},
    {"source": "RISK-900", "target": "MIT-900", "relationship": "risk_to_mitigation"},
    {"source": "MIT-900", "target": "TEST-901", "relationship": "mitigation_to_test"},
    {"source": "TEST-900", "target": "EVID-900", "relationship": "test_to_evidence"},
    {"source": "TEST-901", "target": "EVID-901", "relationship": "test_to_evidence"}
  ],
  "test_plan": {
    "families": ["static", "unit", "integration", "contract", "e2e", "acceptance", "regression", "security", "operations"],
    "tests": [
      {"id": "TEST-900", "family": "acceptance", "covers": ["FR-900", "AC-900"]},
      {"id": "TEST-901", "family": "security", "covers": ["RISK-900", "MIT-900"]}
    ]
  },
  "documentation_impact": {"declared": true, "types": ["security", "operations"]},
  "architecture_impact": {"significant": false, "adr_ids": []},
  "release": {"rollback_strategy": "Revert the exact change and redeploy the prior artifact.", "observability_plan": "Monitor deletion authorization denials and destructive-action audit events."},
  "evidence": {
    "sha": "aaaaaaaaaaaaaaaaaaaaaaaaaaaaaaaaaaaaaaaa",
    "verified_requirements": ["FR-900"],
    "verified_acceptance_criteria": ["AC-900"],
    "artifacts": [
      {"id": "EVID-900", "kind": "test-result", "reference": "ci://acceptance/TEST-900"},
      {"id": "EVID-901", "kind": "test-result", "reference": "ci://security/TEST-901"}
    ],
    "references": [
      {
        "id": "EVID-900",
        "provider": "github_actions",
        "source_kind": "artifact",
        "workflow_run_id": 101,
        "artifact_id": 201,
        "artifact_name": "quality-evidence",
        "parser": {"kind": "junit_xml", "version": 1, "path": "acceptance.xml", "family": "acceptance"}
      },
      {
        "id": "EVID-901",
        "provider": "github_actions",
        "source_kind": "artifact",
        "workflow_run_id": 101,
        "artifact_id": 201,
        "artifact_name": "quality-evidence",
        "parser": {"kind": "junit_xml", "version": 1, "path": "security.xml", "family": "security"}
      },
      {
        "id": "EVID-902",
        "provider": "github_actions",
        "source_kind": "artifact",
        "workflow_run_id": 101,
        "artifact_id": 201,
        "artifact_name": "quality-evidence",
        "parser": {"kind": "onecompany_quality_json_v1", "version": 1, "path": "quality.json"}
      }
    ],
    "review_reference": {"review_id": 303},
    "coverage": {"line": 92, "branch": 88, "changed_line": 100, "mutation": 76},
    "test_family_results": {"static": "pass", "unit": "pass", "integration": "pass", "contract": "pass", "e2e": "pass", "acceptance": "pass", "regression": "pass", "security": "pass", "operations": "pass"},
    "gates": {"requirements": "pass", "risk": "pass", "architecture": "pass", "code_quality": "pass", "functional_qa": "pass", "nonfunctional_qa": "pass", "documentation": "pass", "independent_review": "pass"},
    "independent_review": {"actor": "reviewer-example", "sha": "aaaaaaaaaaaaaaaaaaaaaaaaaaaaaaaaaaaaaaaa", "verdict": "pass"}
  }
}
